{
  "$schema": "../_schema/ev-battery-manifest.schema.json",
  "manifest_version": "1.0.0",
  "generated": "2026-05-10",
  "vendor_files": [
    { "vendor": "hmg",        "file": "hmg.json",        "coverage": "full",    "primary_source": "https://github.com/JejuSoul/OBD-PIDs-for-HKMC-EVs" },
    { "vendor": "nissan",     "file": "nissan.json",     "coverage": "full",    "primary_source": "https://github.com/openvehicles/Open-Vehicle-Monitoring-System-3/blob/master/vehicle/OVMS.V3/components/vehicle_nissanleaf/src/vehicle_nissanleaf.cpp" },
    { "vendor": "bmw",        "file": "bmw.json",        "coverage": "partial", "primary_source": "https://github.com/openvehicles/Open-Vehicle-Monitoring-System-3/tree/master/vehicle/OVMS.V3/components/vehicle_bmwi3" },
    { "vendor": "vw",         "file": "vw.json",         "coverage": "full-eup-partial-meb", "primary_source": "https://github.com/openvehicles/Open-Vehicle-Monitoring-System-3/blob/master/vehicle/OVMS.V3/components/vehicle_vweup/src/vweup_obd.cpp" },
    { "vendor": "renault",    "file": "renault.json",    "coverage": "partial", "primary_source": "https://canze.fisch.lu/" },
    { "vendor": "tesla",      "file": "tesla.json",      "coverage": "not-applicable", "primary_source": "https://github.com/joshwardell/model3dbc" },
    { "vendor": "porsche",    "file": "porsche.json",    "coverage": "none",    "primary_source": null },
    { "vendor": "polestar",   "file": "polestar.json",   "coverage": "minimal", "primary_source": "https://www.polestar-forum.com/threads/howto-read-bms-soh-with-car-scanner-elm327.19509/" },
    { "vendor": "mercedes",   "file": "mercedes.json",   "coverage": "none",    "primary_source": null },
    { "vendor": "stellantis", "file": "stellantis.json", "coverage": "none",    "primary_source": "https://github.com/openvehicles/Open-Vehicle-Monitoring-System-3/issues/719" },
    { "vendor": "honda",      "file": "honda.json",      "coverage": "none",    "primary_source": null },
    { "vendor": "mazda",      "file": "mazda.json",      "coverage": "none",    "primary_source": "https://www.mx30forum.com/threads/obd2-and-our-mx-30.321/" },
    { "vendor": "toyota",     "file": "toyota.json",     "coverage": "none",    "primary_source": "https://www.solterraforum.com/threads/pids-obd-commands.1172/" },
    { "vendor": "ford",       "file": "ford.json",       "coverage": "minimal", "primary_source": "https://www.macheforum.com/" },
    { "vendor": "gm",         "file": "gm.json",         "coverage": "partial-bolt-only", "primary_source": "https://allev.info/boltpids/" }
  ],
  "all_sources": [
    "https://github.com/JejuSoul/OBD-PIDs-for-HKMC-EVs",
    "https://github.com/JejuSoul/OBD-PIDs-for-HKMC-EVs/blob/master/Hyundai%20Kona%20EV%20%26%20Kia%20Niro%20EV/extendedpids/003_Kona%26Niro_EV_BMS.csv",
    "https://github.com/JejuSoul/OBD-PIDs-for-HKMC-EVs/blob/master/Hyundai%20Kona%20EV%20%26%20Kia%20Niro%20EV/extendedpids/004_Kona%26Niro_EV_BMS_cell_data.csv",
    "https://github.com/JejuSoul/OBD-PIDs-for-HKMC-EVs/blob/master/Hyundai%20Kona%20EV%20%26%20Kia%20Niro%20EV/extendedpids/005_Kona%26Niro_EV_Extra_gauges.csv",
    "https://github.com/openvehicles/Open-Vehicle-Monitoring-System-3/blob/master/vehicle/OVMS.V3/components/vehicle_nissanleaf/src/vehicle_nissanleaf.cpp",
    "https://github.com/openvehicles/Open-Vehicle-Monitoring-System-3/blob/master/vehicle/OVMS.V3/components/vehicle_vweup/src/vweup_obd.cpp",
    "https://github.com/openvehicles/Open-Vehicle-Monitoring-System-3/tree/master/vehicle/OVMS.V3/components/vehicle_bmwi3",
    "https://docs.openvehicles.com/en/latest/components/vehicle_bmwi3/docs/index.html",
    "https://github.com/openvehicles/Open-Vehicle-Monitoring-System-3/tree/master/vehicle/OVMS.V3/components/vehicle_renaultzoe",
    "https://canze.fisch.lu/",
    "https://canze.fisch.lu/battery-health-status/",
    "https://github.com/dalathegreat/leaf_can_bus_messages",
    "https://allev.info/boltpids/",
    "https://www.chevybolt.org/threads/chevrolet-bolt-obd2-pids.26666/",
    "https://www.polestar-forum.com/threads/howto-read-bms-soh-with-car-scanner-elm327.19509/",
    "https://www.macheforum.com/site/threads/ford-mach-e-12v-lvb-5a-discharging-charging-cycles-recorded-bms-lin-voltage-soc-and-obdii-pin-voltage.13994/",
    "https://www.f150lightningforum.com/forum/threads/elevated-hvb-module-variation-whats-yours-solved-post-26.35165/",
    "https://www.solterraforum.com/threads/pids-obd-commands.1172/",
    "https://www.mx30forum.com/threads/obd2-and-our-mx-30.321/",
    "https://www.openvehicles.com/node/2420",
    "https://github.com/openvehicles/Open-Vehicle-Monitoring-System-3/issues/719"
  ]
}
